image_id,fname,caption,gt,mentioned,wrong,is_hall
140286,000000140286.jpg,a horse drawn carriage is standing outside a building,horse|person,horse,,False
140420,000000140420.jpg,motorcycle parked on dirt road near trees with foliage,bicycle|motorcycle,motorcycle,,False
140439,000000140439.jpg,some flowers sitting inside of a glass vase,dining table|potted plant|vase,vase,,False
140556,000000140556.jpg,a group of construction workers standing around a fire hydrant,fire hydrant|orange|person|truck,person|fire hydrant,,False
140583,000000140583.jpg,a herd of animals crossing the street into the mountains,cow|person|sheep|truck,,,False
140640,000000140640.jpg,three women are standing together while cutting a cake,cake|dining table|knife|person|potted plant,person|cake,,False
140658,000000140658.jpg,the church is made of stone with two large windows,clock,,,False
140840,000000140840.jpg,kites in an open grassy field during a festival,kite|person|truck,kite,,False
140929,000000140929.jpg,a large clock mounted to the side of a building,clock,clock,,False
140987,000000140987.jpg,a girl holding a plate of food in front of her,chair|cup|dining table|person|pizza|potted plant,person,,False
141328,000000141328.jpg,this is a close up of a pasta salad,bowl|broccoli|spoon,,,False
141597,000000141597.jpg,a van is parked next to a car,car|truck,car|car,,False
141671,000000141671.jpg,a black and white photo shows men riding motorcycles in a field,bench|bicycle|horse|motorcycle|person,person|motorcycle,,False
141821,000000141821.jpg,a very large pizza with toppings on top of it,bench|bottle|bowl|dining table|person|pizza,pizza,,False
142092,000000142092.jpg,a pizza sits on top of a pan of pizza,pizza,pizza|pizza,,False
142238,000000142238.jpg,a soccer team is playing on a field,person|sports ball,,,False
142324,000000142324.jpg,a man driving a motorcycle through the city street,bicycle|handbag|motorcycle|person|truck,person|motorcycle,,False
142472,000000142472.jpg,there are many shops and businesses on the street,bus|car|person|truck,,,False
142585,000000142585.jpg,a street with lots of traffic waiting to cross the road,bus|car|motorcycle|person|traffic light|truck,,,False
142620,000000142620.jpg,a man sitting at a table with food on it,bench|bottle|bowl|chair|cup|dining table|knife|orange|person|spoon,person|dining table,,False
142790,000000142790.jpg,two snow skiers are laying in the snow together,person|skis|snowboard,person,,False
142971,000000142971.jpg,a family that is in the water on surfboards,person|surfboard,surfboard,,False
143068,000000143068.jpg,the kite is being flown on the beach,kite|person,kite,,False
143556,000000143556.jpg,a group of motorcyclists ride around in a row,motorcycle|person,,,False
143572,000000143572.jpg,spectators are watching a tennis game in progress,person|sports ball|tennis racket,,,False
143931,000000143931.jpg,a bus with scott brown advertising is parked,bus|person,,,False
143961,000000143961.jpg,"a crowd at a park, some with umbrellas",backpack|dog|handbag|person|umbrella,umbrella,,False
143998,000000143998.jpg,a bunch of carrots sitting on a cutting board,carrot|dining table|knife,carrot,,False
144003,000000144003.jpg,a man cutting a cake with a woman behind it,bowl|cake|chair|dining table|knife|person|refrigerator|remote,person|cake|person,,False
144114,000000144114.jpg,an airplane that is flying in the sky,airplane|person,airplane,,False
144300,000000144300.jpg,a honda motorcycle parked in the parking lot,bus|car|motorcycle|person|truck,motorcycle,,False
144333,000000144333.jpg,an asian girl on a bicycle in the city,bicycle|car|cell phone|handbag|person,person|bicycle,,False
144706,000000144706.jpg,the view through a rainy glass on the street,car|traffic light|truck,,,False
144784,000000144784.jpg,a hand pushing on the button of a blender,person,,,False
144798,000000144798.jpg,a small bathroom with toys on the floor,book|bottle|cup|person|toilet,,,False
144932,000000144932.jpg,a tugboat on the water in front of a shoreline,boat|person,boat,,False
144984,000000144984.jpg,a young boy playing a video game,couch|orange|person|remote,person,,False
145020,000000145020.jpg,several large stuffed animals are being displayed at disney world,bird|mouse|person|teddy bear,,,False
145591,000000145591.jpg,a clock with roman numerals is in front of palm trees,clock,clock,,False
145597,000000145597.jpg,four women sit in the grass around a picnic blanket,bottle|cup|handbag|orange|person|wine glass,person,,False
145620,000000145620.jpg,a man riding a dirt bike across a dirt track,bicycle|motorcycle|person,person|bicycle,,False
145665,000000145665.jpg,a person laying on the ground in a parking space,person|skateboard,person,,False
145781,000000145781.jpg,a dog chewing on a bottle of beer,bottle|dog,dog|bottle,,False
146155,000000146155.jpg,a man pouring wine in front of another man,bottle|person|wine glass,person|person,,False
146358,000000146358.jpg,a bride and groom with red roses around the cake,cake|chair|dining table|knife|person|tie|wine glass,person|person|cake,,False
146363,000000146363.jpg,an umbrella sitting on top of a beach near the ocean,chair|umbrella,umbrella,,False
146457,000000146457.jpg,two little girls that are in the kitchen,bottle|bowl|chair|dining table|person|pizza,person,,False
146489,000000146489.jpg,a glass of wine next to a slice of pizza,bottle|cell phone|dining table|pizza|wine glass,pizza,,False
146498,000000146498.jpg,green street signs pointing in different directions,car,,,False
146667,000000146667.jpg,a woman is fixing the front end of a moped,apple|backpack|car|chair|handbag|motorcycle|person,person|motorcycle,,False
146825,000000146825.jpg,a red and yellow train is parked at the station,clock|handbag|person|train,train,,False
146831,000000146831.jpg,two young children watching a skateboarder ride a halfpipe,car|person|skateboard,person|person,,False
147205,000000147205.jpg,"meat, potatoes, and other baked items sit on plates",cake|dining table,,,False
147223,000000147223.jpg,a bus on the street with advertising on its side,bus|car,,,False
147338,000000147338.jpg,a yellow fire hydrant with a green face and mouth,car|fire hydrant|truck,fire hydrant,,False
147415,000000147415.jpg,someone sitting in front of a laptop and papers,book|bottle|chair|cup|dining table|keyboard|laptop|person|remote,laptop,,False
147498,000000147498.jpg,a flock of birds flying over a sandy beach,bird|sports ball,bird,,False
147518,000000147518.jpg,"a bathroom with a toilet, mirror, and other items",book|sink|toilet,toilet,,False
147725,000000147725.jpg,an image of a city bus driving down the road,bus|car|person|truck,,,False
147729,000000147729.jpg,a crowd of people sitting in a dark room,cell phone|person,person,,False
147740,000000147740.jpg,a woman with a basket on her head walking down a street,banana|car|handbag|motorcycle|person,person,,False
147745,000000147745.jpg,two large trucks sitting parked on a road,truck,truck,,False
148508,000000148508.jpg,a red double decker bus driving down a street,bus|car|person,,,False
148620,000000148620.jpg,this is a view of an office in the process,dining table|keyboard|laptop|mouse|tv,,,False
148662,000000148662.jpg,a man standing in front of a paper wrapped hotdog,hot dog|person,person,,False
148707,000000148707.jpg,two oranges hanging from a tree filled with leaves,orange,orange,,False
148719,000000148719.jpg,"an old, red pickup truck parked in a yard",person|truck,truck|truck,,False
148730,000000148730.jpg,an old photo of two boats sitting at a pier,boat,boat,,False
148739,000000148739.jpg,a surfer riding on the wave near a pier,person|surfboard,,,False
148783,000000148783.jpg,two zebras in their pen eating and grazing,zebra,zebra,,False
148957,000000148957.jpg,a box of six donuts with different toppings,donut,donut,,False
148999,000000148999.jpg,an outdoor picture of smoke coming from the top,horse|person|traffic light|train,,,False
149222,000000149222.jpg,a cluttered desk with two computers and magazines on top,carrot|cat|dining table|keyboard|laptop|mouse|person|tv,dining table|laptop,,False
149375,000000149375.jpg,the skateboarder is practicing his tricks on the ramp,person|skateboard,person,,False
149406,000000149406.jpg,the motor bike is sitting outside of a dilapidated building,motorcycle,motorcycle,,False
149568,000000149568.jpg,an individual is in the open view in the image,dog|frisbee|person,,,False
149622,000000149622.jpg,two brown owls are sitting in the trees,bird,bird,,False
149770,000000149770.jpg,a man is surfing a wave in the ocean,person|surfboard,person,,False
150224,000000150224.jpg,a beach area that is by the ocean,backpack|chair|handbag|person|umbrella,,,False
150265,000000150265.jpg,two young people on a sidewalk near a fire hydrant,fire hydrant|handbag|person,person|fire hydrant,,False
150417,000000150417.jpg,a woman cutting a birthday cake with candles on it,bowl|cake|chair|cup|dining table|person|refrigerator,person|cake,,False
150638,000000150638.jpg,an outdoor gathering with various beverages on a table,bench|bottle|cup|dining table|person,dining table,,False
150649,000000150649.jpg,a skateboarder rides up the side of a skate ramp,person|skateboard,person,,False
150726,000000150726.jpg,two giraffes are walking in their enclosure,giraffe,giraffe,,False
150930,000000150930.jpg,a large clock hanging from the side of a building,clock,clock,,False
151000,000000151000.jpg,a young couple is taking pictures in front of a building,cell phone|handbag|person|tie,,,False
151051,000000151051.jpg,a person snowboarding on a snowy mountain,person|skis,person,,False
151480,000000151480.jpg,a baseball team walks off the field,backpack|baseball glove|person,,,False
151516,000000151516.jpg,there is an eagle that is flying in the water,bird,,,False
151629,000000151629.jpg,a man holding a racquet on a tennis court,person|sports ball|tennis racket,person,,False
151657,000000151657.jpg,the couple is dressed up for halloween posing,person|sports ball|tie,,,False
151662,000000151662.jpg,a giraffe in a fenced enclosure eating from a feed,giraffe,giraffe,,False
151820,000000151820.jpg,several people sitting at a table eating and drinking,bottle|chair|cup|dining table|handbag|person|spoon|wine glass,person|dining table,,False
151857,000000151857.jpg,an old train parked on the tracks near a platform,person|train,train,,False
151938,000000151938.jpg,a group of people standing around a long table,bottle|cup|dining table|person|umbrella|wine glass,person|dining table,,False
151962,000000151962.jpg,a dog sticking his head out the window,car|dog|person,dog,,False
152120,000000152120.jpg,a man riding a green motorcycle down a street,motorcycle|person,person|motorcycle,,False
152214,000000152214.jpg,a man wearing a tie smiling for the camera,person|tie,person|tie,,False
152465,000000152465.jpg,the tire has fallen off of a pole,bicycle|fire hydrant,,,False
152686,000000152686.jpg,a man hitting a tennis ball with a racquet,orange|person|sports ball|tennis racket,person|sports ball,,False
152740,000000152740.jpg,black and brown cows on open pasture grazing,cow,cow,,False
152771,000000152771.jpg,a bicycle sitting in a parking lot with trees,bicycle|car|fire hydrant,bicycle,,False
152870,000000152870.jpg,a giraffe standing next to a bush in the wilderness,giraffe,giraffe,,False
153011,000000153011.jpg,there is a food truck that sells the tasty treat,bus|car|chair|dining table|handbag|person|truck,truck,,False
153217,000000153217.jpg,a black cat is standing near a parked motorcycle,cat|motorcycle,cat|motorcycle,,False
153229,000000153229.jpg,a group of young men playing a game of frisbee,frisbee|person,person|frisbee,,False
153299,000000153299.jpg,two giraffes are standing near one another,giraffe|person,giraffe,,False
153343,000000153343.jpg,stuffed bears are posed in front of a green hedge,bear|mouse|teddy bear,bear,,False
153510,000000153510.jpg,"a plate with rice, chicken and vegetables on it",bed|broccoli|carrot,,,False
153527,000000153527.jpg,a brick walkway that runs past some buildings,bench|bicycle|bottle|chair|couch|knife|person,,,False
153529,000000153529.jpg,a woman in white shirt standing near suitcases,backpack|handbag|person|suitcase|train,person|suitcase,,False
153568,000000153568.jpg,a stop sign with writings and graffiti written on it,stop sign,stop sign,,False
153632,000000153632.jpg,an image of meat with gravy on white plate,bowl|dining table|fork|knife,,,False
153669,000000153669.jpg,a batter in a blue uniform holding a red bat,baseball bat|baseball glove|bench|person|sports ball,,,False
153782,000000153782.jpg,3d images of a clock tower atop a building,clock,clock,,False
153797,000000153797.jpg,a baseball player in the middle of throwing a pitch,baseball glove|person|sports ball,person,,False
154000,000000154000.jpg,a dump truck is parked on a dirt road,truck,truck,,False
154004,000000154004.jpg,several people gather on the beach on a sunny day,person|surfboard,person,,False
154087,000000154087.jpg,people with canadian flags are standing outside the mountains,person|skis,person,,False
154213,000000154213.jpg,a pie being prepared in a tin on a wooden surface,dining table|scissors,,,False
154339,000000154339.jpg,an image of some pipes in blue lighting,clock,,,False
154358,000000154358.jpg,an image of a living room with red walls,book|chair|dining table|handbag|person|potted plant|vase,,,False
154425,000000154425.jpg,a young boy is flying a kite on the sidewalk,kite|person,person|kite,,False
154431,000000154431.jpg,a small statue is standing in front of a tv,book|remote|tv|vase,tv,,False
154644,000000154644.jpg,there is a woman smoking a cigarette next to a wine glass,cell phone|person|wine glass,person,,False
154705,000000154705.jpg,two laptops sitting on a white desk with a printer,book|dining table|keyboard|laptop|mouse|tv,laptop|dining table,,False
154718,000000154718.jpg,a messy toilet with pink toilet paper and spools of toilet paper,person|toilet,toilet|toilet|toilet,,False
154947,000000154947.jpg,black and white photograph of a sheep on grassy field,sheep,sheep,,False
155051,000000155051.jpg,a clock with roman numerals and an moon in the background,clock,clock,,False
155145,000000155145.jpg,two boats on the side of the water next to a cliff,boat|person|umbrella,boat,,False
155154,000000155154.jpg,bathroom stall in a plane with various items around,airplane|toilet,airplane,,False
155179,000000155179.jpg,a cake with a lot of chocolate chips on it,cake|dining table,cake,,False
155291,000000155291.jpg,a cat laying on top of a wooden window sill,cat|orange,cat,,False
155341,000000155341.jpg,a vehicle parked on the street in front of a truck,car|person|truck,truck,,False
155443,000000155443.jpg,a train is pulling into a train station,person|traffic light|train,train|train,,False
155451,000000155451.jpg,a green light shining under a overpass at night,car|traffic light,,,False
155571,000000155571.jpg,an elephant walks on grass towards a tree,elephant,elephant,,False
156071,000000156071.jpg,several people watching a crowd of spectators in an arena,car|person|sheep,person,,False
156076,000000156076.jpg,three guys in yellow shirts eating a large pizza,bottle|bowl|cell phone|cup|dining table|fork|knife|person|pizza|spoon,person|pizza,,False
156278,000000156278.jpg,a kitchen has wooden cabinets and an oven,apple|book|bowl|chair|clock|dining table|knife|refrigerator|sink,oven,oven,True
156292,000000156292.jpg,the building has many different clocks on the front,clock|handbag|person,clock,,False
156372,000000156372.jpg,a chair on the deck of a ship,backpack|boat|chair|suitcase,chair|boat,,False
156643,000000156643.jpg,a man posing behind a cake at a booth,bottle|cake|chair|cup|dining table|knife|person|teddy bear,person|cake,,False
156924,000000156924.jpg,two people play nintendo wii while a person watches,chair|person|remote,person|person,,False
157046,000000157046.jpg,someone's hand holding a nintendo wii remote near a projector,person|remote,remote,,False
157098,000000157098.jpg,three giraffes are standing around in a grassy area,giraffe,giraffe,,False
157124,000000157124.jpg,large white bathroom sink with drawers and storage,sink,sink,,False
157138,000000157138.jpg,a plate that has two pieces of cake on it,cake|fork,cake,,False
157213,000000157213.jpg,an elephant stands in a clearing of vegetation,elephant,elephant,,False
157365,000000157365.jpg,a man in plaid shirt on a skateboard by street,car|person|skateboard|traffic light,person|skateboard,,False
157390,000000157390.jpg,a bunch of vegetables that are in a bowl,bowl|broccoli|carrot|dining table,bowl,,False
157418,000000157418.jpg,a bowl of spam with some bread on a plate,bottle|bowl|cup|dining table|sandwich,bowl,,False
157601,000000157601.jpg,a woman is eating a pastry at a cafe,cup|dining table|hot dog|person|sandwich,person,,False
157756,000000157756.jpg,a large brick clock tower lit up at night,bicycle|car|clock|handbag|person|traffic light|truck,clock,,False
157767,000000157767.jpg,two men at a social gathering about food,book|bowl|cell phone|cup|dining table|handbag|person|spoon,person,,False
157807,000000157807.jpg,cat standing on the back end of a toilet,cat|chair|person|sink|toilet,cat|toilet,,False
157847,000000157847.jpg,a hawk flying in a green field near mountains,bird,,,False
157928,000000157928.jpg,a skier leaning over in the snow by his gear,backpack|car|person|skis,person,,False
158227,000000158227.jpg,a young child with a black helmet holding a bat,baseball bat|person|sports ball,person,,False
158548,000000158548.jpg,an image of two sheep at a sporting event,car|motorcycle|person|sheep|truck,sheep,,False
158660,000000158660.jpg,plates of fruit with labels sit on the counter top,apple|banana|bowl|oven|person,,,False
158744,000000158744.jpg,two different pictures of a person pushing some furniture,car|chair|couch|dining table|fire hydrant|person|suitcase,person,,False
158945,000000158945.jpg,an elephant is being led along by its trainer,chair|elephant|person,elephant,,False
158956,000000158956.jpg,a woman in a red dress cutting a cake,cake|chair|handbag|knife|person,person|cake,,False
159112,000000159112.jpg,"pizza with tomatoes, cheese, meat, and other toppings",pizza,pizza,,False
159282,000000159282.jpg,there is some flower that are in the glass,potted plant|vase,,,False
159311,000000159311.jpg,three zebras eat grass together on the savannah,zebra,zebra,,False
159399,000000159399.jpg,someone in a park flying a kite in the sky,backpack|kite|person,kite,,False
159458,000000159458.jpg,a bedroom with a dog laying on the bed,bed|chair|dog|person,dog|bed,,False
159684,000000159684.jpg,the high speed train is sitting on the track,clock|train,train,,False
159791,000000159791.jpg,a refrigerator in a white kitchen decorated with magnets,bird|bowl|chair|microwave|oven|person|refrigerator,refrigerator,,False
159977,000000159977.jpg,a giraffe standing on top of a lush green field,bird|giraffe|zebra,giraffe,,False
160012,000000160012.jpg,a pizza with various tomatoes being cut on top,bottle|car|chair|dining table|fork|knife|person|pizza,pizza,,False
160556,000000160556.jpg,people sitting around a table and using computers,cell phone|dining table|keyboard|laptop|microwave|person|teddy bear|tv,person|dining table|laptop,,False
160666,000000160666.jpg,toothpaste tube next to dental floss with red handle on counter,bottle|toothbrush,,,False
160728,000000160728.jpg,a group of people in a bay near some boats,boat|car|person|surfboard,person|boat,,False
160772,000000160772.jpg,the large boat travels through the ocean near a lighthouse,boat|person,boat,,False
160864,000000160864.jpg,a batter is ready for the pitch at a baseball game,baseball bat|baseball glove|chair|person|sports ball,,,False
161008,000000161008.jpg,a black pair of scissors sitting in a box,dining table|scissors,scissors,,False
161032,000000161032.jpg,a woman is in a dilapidated room holding an umbrella,person|umbrella,person|umbrella,,False
161044,000000161044.jpg,some small airplanes flying together under dark clouds,airplane,airplane,,False
161128,000000161128.jpg,a sign that is standing up on a pole,bus|car|fire hydrant|person|truck,,,False
161397,000000161397.jpg,flower arrangements sit on a table on a market,dining table|person|vase,dining table,,False
161609,000000161609.jpg,people are waiting at the stairs to get their picture taken,backpack|dog|handbag|person,person,,False
161642,000000161642.jpg,an odd looking clock hanging from the wall,clock,clock,,False
161781,000000161781.jpg,a female skier wearing a white outfit and green helmet,person|skis,person|person,,False
161799,000000161799.jpg,a skateboarder doing tricks in an open skate park,person|skateboard,person,,False
161820,000000161820.jpg,the large bunch of green bananas are unripe,banana|dining table,banana,,False
161861,000000161861.jpg,a woman holding a tennis racquet on a tennis court,person|sports ball|tennis racket,person,,False
161875,000000161875.jpg,the girl is standing alone by the bare tree and grass,person|tie,person,,False
161879,000000161879.jpg,a skateboarder does tricks on a ramp in the dark,person|skateboard,person,,False
161925,000000161925.jpg,two women preparing food at a street side barbecue,knife|person|pizza,person,,False
161978,000000161978.jpg,a group of photos showing the steps of skateboarding in an area,person|skateboard,,,False
162035,000000162035.jpg,a sign that says teddy bear tea rooms upstairs,person|teddy bear,teddy bear,,False
162092,000000162092.jpg,people standing in a room with some candles and other food on the counter,cake|chair|fork|person,person,,False
162130,000000162130.jpg,an empty park bench in front of a grassy area,bench,bench,,False
162366,000000162366.jpg,a public restroom sign stands next to a brick wall,car|parking meter,,,False
162415,000000162415.jpg,little girl in purple baseball uniform holding a catchers mitt,baseball glove|person|sports ball,person,,False
162543,000000162543.jpg,several elephants in their pen at the zoo,elephant|umbrella,elephant,,False
162581,000000162581.jpg,a man swinging a tennis racquet on a tennis court,person|sports ball|tennis racket,person,,False
162732,000000162732.jpg,five male soccer players have a discussion on the field,person|sports ball,person|person,,False
162858,000000162858.jpg,a street with cars stopped at a red light,bicycle|car|person|traffic light,car,,False
163057,000000163057.jpg,a large group of people flying kites in a park,car|kite|person,person|kite,,False
163117,000000163117.jpg,a group of people watching a large display of kites,backpack|handbag|kite|person,person|kite,,False
163118,000000163118.jpg,two boys jumping for the frisbee in the gym,frisbee|person,person|frisbee,,False
163155,000000163155.jpg,a cat sitting on concrete near a brick building,cat,cat,,False
163257,000000163257.jpg,a man in a neon green sweatshirt holding a pink bat,person|umbrella,person,,False
163258,000000163258.jpg,the bathroom has black tiles and white fixtures,sink|toilet,,,False
163290,000000163290.jpg,two zebras standing next to one another behind a fence,giraffe|zebra,zebra,,False
163314,000000163314.jpg,people walking in and out of a shopping building,backpack|handbag|person|suitcase,person,,False
163562,000000163562.jpg,a man holding a frisbee in his right hand,frisbee|person,person|frisbee,,False
163611,000000163611.jpg,pizza on a red plate with silverware,cup|dining table|fork|knife|pizza,pizza,,False
163640,000000163640.jpg,a man eating outside with a friend at the side,backpack|bowl|donut|person,person,,False
163682,000000163682.jpg,the man is posing for a picture in his office,chair|person|tie,person,,False
163746,000000163746.jpg,a group of girls walking into the water,airplane|person,person,,False
163951,000000163951.jpg,a photo and some other objects laying on a white surface,banana|chair,,,False
164115,000000164115.jpg,there is a surf board on the street,bicycle|surfboard,,,False
164363,000000164363.jpg,a clock with roman numerals and a clock face,clock,clock|clock,,False
164602,000000164602.jpg,two people standing together brushing their teeth,person|sink|toothbrush,person,,False
164637,000000164637.jpg,small vanity in green bathroom decorated with a pastel wall color,sink,,,False
164883,000000164883.jpg,a young man playing the nintendo wii video game,person|remote|tv,person,,False
164885,000000164885.jpg,a skier jumping in the air on a sunny day,person|skis,person,,False
164969,000000164969.jpg,an open box of pizza with three different toppings,dining table|pizza,pizza,,False
165039,000000165039.jpg,the city bus has a political ad on it's windshield,bus|car|person|traffic light,,,False
165257,000000165257.jpg,kitchen counter with a black counter top and wooden cabinets,sink,,,False
165336,000000165336.jpg,three giraffes that are standing in the grass,giraffe|zebra,giraffe,,False
165351,000000165351.jpg,"a breakfast of waffles, bananas and syrup on top",banana|cake|dining table,banana,,False
165500,000000165500.jpg,a group of animals grazing in a field,bear|cow,,,False
165518,000000165518.jpg,a motorcyclist in the fog lights his bike,motorcycle|person,bicycle,bicycle,True
165681,000000165681.jpg,motorbikes are lined up in a street in the city,car|dining table|motorcycle|person|truck,motorcycle,,False
165713,000000165713.jpg,a silver fire hydrant sitting next to a pole,fire hydrant,fire hydrant,,False
165831,000000165831.jpg,a metal pan with carrots and kale on top,bottle|bowl|broccoli|carrot|dining table|orange,carrot,,False
166165,000000166165.jpg,"two pictures, one showing two women playing tennis",person|tennis racket,person,,False
166166,000000166166.jpg,a living room scene with television on table and magazine on table,book|chair|dining table|remote|tv|vase,tv|dining table|dining table,,False
166259,000000166259.jpg,three ducks walking on a wooden deck near some steps,bird|person,bird,,False
