image_id,fname,caption,gt,mentioned,wrong,is_hall
275058,000000275058.jpg,a person riding the waves with a para sail,kite|person|surfboard,person,,False
275198,000000275198.jpg,a family sharing a meal together with an umbrella and drinks,bottle|bowl|chair|cup|dining table|fork|knife|person|spoon|umbrella,umbrella,,False
275392,000000275392.jpg,a woman rides a horse with blonde hair,horse|person,person|horse,,False
275727,000000275727.jpg,a yellow and grey train passing by at a station,traffic light|train,train,,False
275749,000000275749.jpg,a group of people standing around a room,bottle|chair|cup|dining table|laptop|mouse|person|tv,person,,False
275791,000000275791.jpg,a train that is traveling along side of some water,boat|train,train,,False
276018,000000276018.jpg,a group of children are holding stuffed animals,person|teddy bear,person,,False
276024,000000276024.jpg,a couple of people are riding horses along a path,cow|horse|person,person|horse,,False
276055,000000276055.jpg,woman holding up a vegetable and a glass of juice,bottle|carrot|chair|cup|dining table|person|umbrella,person,,False
276284,000000276284.jpg,a parked blue motorcycle sits in the parking lot,car|motorcycle,motorcycle,,False
276285,000000276285.jpg,an individual eating food at a restaurant,chair|cup|dining table|fork|knife|person|pizza,,,False
276434,000000276434.jpg,a white wedding cake with grapes on it,cake|dining table|knife|orange|person,cake,,False
276707,000000276707.jpg,a sign is posted on the side of a street,car|person,,,False
276720,000000276720.jpg,a wide shot of a street with old buildings,car|truck,,,False
276804,000000276804.jpg,a baseball game is being played on an outdoor field,baseball bat|baseball glove|person|sports ball,,,False
276921,000000276921.jpg,two teddy bears are hanging from a tree,car|teddy bear,teddy bear,,False
277005,000000277005.jpg,a pedestrian is on the street going by an intersection,backpack|bicycle|car|person|train,,,False
277020,000000277020.jpg,two asian businessmen at a restaurant with their guests,bowl|chair|cup|dining table|person|tie,,,False
277051,000000277051.jpg,two small birds are perched on the table,bird|bottle|chair|dining table|knife,bird|dining table,,False
277197,000000277197.jpg,a living room with antique furniture in it,chair|couch|dining table|potted plant|vase,,,False
277584,000000277584.jpg,a black and white cat sitting in the window sill,bench|cat,cat,,False
277689,000000277689.jpg,a white wedding cake decorated with red flowers,cake|cup|dining table|wine glass,cake,,False
278006,000000278006.jpg,a street sign in front of a row of houses,,,,False
278353,000000278353.jpg,a sheep standing in grass behind a fence,sheep,sheep,,False
278463,000000278463.jpg,a wooden desk topped with lots of stuff,book|bottle|cat|cell phone|cup|dining table|laptop|potted plant,dining table,,False
278705,000000278705.jpg,two kids are skateboarding on the street,car|person|skateboard,person,,False
278749,000000278749.jpg,black and white image of man holding a subway sign,car|handbag|person,person,,False
278848,000000278848.jpg,a bus and some people holding umbrellas in the rain,bus|car|person|umbrella,person|umbrella,,False
278973,000000278973.jpg,a person riding a surf board in the ocean,person|surfboard,person,,False
279145,000000279145.jpg,there is a bench and some plants in the yard,bench|cat|potted plant,bench,,False
279278,000000279278.jpg,people are standing on a street in an outdoor space,bicycle|cup|dog|handbag|person|skateboard,person,,False
279541,000000279541.jpg,a long counter filled with lots of different sized pizzas,person|pizza,pizza,,False
279714,000000279714.jpg,a parking meter with a sign on it,baseball bat|car|parking meter|sports ball,parking meter,,False
279730,000000279730.jpg,a hand holding up food at a restaurant,cup|dining table|hot dog|person|sandwich,,,False
279769,000000279769.jpg,a banana is on top of a paper bag,banana|dining table,banana,,False
279774,000000279774.jpg,an image of a boy up to bat,baseball bat|chair|person|sports ball,person,,False
279887,000000279887.jpg,the motorcycle is on display on display in a museum,bicycle|motorcycle,motorcycle,,False
279927,000000279927.jpg,a large crowd of people standing on top of a field,person|umbrella,person,,False
280325,000000280325.jpg,the word art is written on the wall,parking meter,,,False
280710,000000280710.jpg,several people walk in the city near some buildings,backpack|bus|handbag|person|suitcase|traffic light,person,,False
280779,000000280779.jpg,a skier is going through the snow in a forested area,backpack|person|skis,person,,False
280891,000000280891.jpg,a young boy and a woman with many fruits together,apple|bottle|handbag|orange|person,person|person,,False
280918,000000280918.jpg,two women in the kitchen cooking turkey for dinner,bird|bottle|oven|person|refrigerator|spoon,person|bird,,False
280930,000000280930.jpg,a little girl that is holding some food,bottle|oven|person|refrigerator,person,,False
281032,000000281032.jpg,an old man making food from a roaster,oven|person|spoon,person,,False
281179,000000281179.jpg,the view down the street at christmas lights,bench|fire hydrant|traffic light,,,False
281409,000000281409.jpg,the batter and the catcher are on their knees,baseball bat|baseball glove|chair|person|sports ball,,,False
281414,000000281414.jpg,a woman is sitting on the side of a building,backpack|book|cell phone|person,person,,False
281447,000000281447.jpg,a horse with blonde hair on some grass,horse,horse,,False
281687,000000281687.jpg,woman with camera taking photo of others in busy street,car|cell phone|handbag|person,person,,False
281693,000000281693.jpg,two large jet airliners sitting at an airport,airplane|person|truck,airplane,,False
281754,000000281754.jpg,a woman sitting on a ledge with a little boy,handbag|person|umbrella,person|person,,False
281759,000000281759.jpg,a group of women standing next to each other holding umbrellas,person|truck|umbrella,person|umbrella,,False
281929,000000281929.jpg,a man standing with his bicycle outside of a house,bicycle|person|tie,person|bicycle,,False
282037,000000282037.jpg,the players are playing a game of baseball,baseball glove|chair|person|sports ball,person,,False
282046,000000282046.jpg,an empty blue bench is sitting on a beach,bench,bench,,False
282296,000000282296.jpg,an old style refrigerator is standing in the corner,bottle|refrigerator,refrigerator,,False
282298,000000282298.jpg,a crowd of people walking around an open area,backpack|clock|handbag|person|train,person,,False
282912,000000282912.jpg,a giraffe has its head looking off to the right,giraffe|person,giraffe,,False
283037,000000283037.jpg,a car stopped at an intersection on the street,car|traffic light,car,,False
283038,000000283038.jpg,a stop sign on a city street corner,car|stop sign|traffic light|truck,stop sign,,False
283070,000000283070.jpg,three oranges are shown on a wooden surface,dining table|orange,orange,,False
283113,000000283113.jpg,two large hot dogs that are covered in mustard,cup|dining table|hot dog,hot dog,,False
283268,000000283268.jpg,a person holds a toy hotdog on a plate,hot dog|person,person,,False
283318,000000283318.jpg,an open doorway restaurant located on the corner,book|car|fire hydrant|person,,,False
283412,000000283412.jpg,a fluffy little white dog looking up at a newspaper,bed|cup|dining table|dog,dog,,False
283520,000000283520.jpg,a couple of guys standing next to each other,frisbee|person,person,,False
283717,000000283717.jpg,a black microwave sitting on top of a small table,dining table|microwave|oven|toaster,microwave|dining table,,False
283785,000000283785.jpg,there is a man in a lion costume giving a lecture to children,book|person|teddy bear,person|person,,False
284106,000000284106.jpg,a tray of food with rice and meat,bowl|carrot|dining table,,,False
284279,000000284279.jpg,a small bird on top of a large green feeder,bird,bird,,False
284282,000000284282.jpg,a blender sitting on top of a counter next to a printer,dining table,,,False
284296,000000284296.jpg,three giraffes are drinking water from a water hole,giraffe,giraffe,,False
284445,000000284445.jpg,a street corner that has a very large crowd,backpack|bus|car|person|traffic light,,,False
284623,000000284623.jpg,a black cat is sitting on the bathroom counter,bottle|cat|sink|toothbrush,cat,,False
284698,000000284698.jpg,a man taking a picture of himself in a side mirror,car|cell phone|motorcycle|person|remote,person,,False
284725,000000284725.jpg,a red bus stopped at an intersection with traffic and trees,bus|car|person,,,False
284743,000000284743.jpg,a woman holding a baseball bat in a crowd,baseball bat|person,person|baseball bat,,False
284762,000000284762.jpg,a traffic light with red lit signal attached to it,traffic light,traffic light,,False
284764,000000284764.jpg,a man eating a bowl of food on a plate,bowl|cell phone|cup|dining table|knife|person|spoon,person|bowl,,False
284991,000000284991.jpg,man drinking a red beverage from a plastic bottle,bottle|person,person|bottle,,False
285047,000000285047.jpg,a man sitting down looking at his cellphone,cell phone|cup|dining table|person,person|cell phone,,False
285349,000000285349.jpg,close up of a heart made from colorful origami cranes,bird|bowl|vase,,,False
285788,000000285788.jpg,two giraffes on a grassy field next to rocks,bird|giraffe,giraffe,,False
285894,000000285894.jpg,the children are watching two giraffes in the enclosure,giraffe|person,person|giraffe,,False
286182,000000286182.jpg,a man that is sitting at a table with food,book|bottle|bowl|broccoli|carrot|chair|dining table|fork|person|spoon,person|dining table,,False
286422,000000286422.jpg,the woman is sitting on the sail boat,boat|dog|person,person|boat,,False
286458,000000286458.jpg,two pictures show a suitcase filled with personal items,backpack|bed|handbag|suitcase|teddy bear,suitcase,,False
286503,000000286503.jpg,an elephant in a fenced area feeding from a feeder,elephant|person|sports ball,elephant,,False
286507,000000286507.jpg,a train traveling through a snow covered rural countryside,car|train,train,,False
286523,000000286523.jpg,a man with glasses and a red hat on,cell phone|person,person,,False
286553,000000286553.jpg,a smiling man and woman sitting at a table,bottle|chair|cup|dining table|fork|knife|person|pizza|umbrella,person|person|dining table,,False
286660,000000286660.jpg,a woman is kissing a stuffed bear with teeth,person|teddy bear,person|bear,bear,True
286708,000000286708.jpg,a black and white cat wearing a pink knitted hat,cat,cat,,False
286849,000000286849.jpg,three giraffes poking their heads out from behind some rocks,giraffe,giraffe,,False
286907,000000286907.jpg,a bathroom with a toilet and some buckets,toilet,toilet,,False
286908,000000286908.jpg,many different pictures of different types of foods,bowl|cup|dining table|donut,,,False
286994,000000286994.jpg,an elephant is drinking at a water hole,elephant,elephant,,False
287291,000000287291.jpg,a busy intersection in an urban neighborhood on a rainy day,car|person|traffic light|truck,,,False
287347,000000287347.jpg,a man and woman prepare pizza at home,bottle|bowl|cup|knife|laptop|person|pizza,person|person|pizza,,False
287527,000000287527.jpg,two people posing for a selfie picture together,person|tie,person,,False
287545,000000287545.jpg,a giraffe standing next to a baby in an enclosed area,giraffe,giraffe|person,person,True
287649,000000287649.jpg,a very cute cat sitting by some computer keyboards,book|cat|dining table|keyboard|laptop,cat|laptop|keyboard,,False
287667,000000287667.jpg,a cutting board with an onion and an egg,book|carrot|dining table|knife|orange|person|sports ball,,,False
287714,000000287714.jpg,a hotel bathroom with light on over the bathtub,bottle|cup|sink,,,False
287874,000000287874.jpg,a train pulling up to a platform at a station,bench|handbag|person|suitcase|train,train,,False
287959,000000287959.jpg,a sandwich with meat and pickles on a roll,sandwich,sandwich,,False
288042,000000288042.jpg,person standing by river in urban area of town,person|truck|umbrella,person,,False
288062,000000288062.jpg,a toilet in a bathroom with blue walls,chair|toilet,toilet,,False
288391,000000288391.jpg,a cell phone hanging on a wall next to a window,cell phone,cell phone,,False
288430,000000288430.jpg,a group of people flying kites on a beach,boat|kite|person,person|kite,,False
288584,000000288584.jpg,people walking around and looking at a tall giraffe,backpack|chair|dining table|giraffe|handbag|person,person|giraffe,,False
288685,000000288685.jpg,two men herding sheep in front of a crowd,bench|dog|handbag|person|sheep,person|sheep,,False
288762,000000288762.jpg,a white plate topped with lots of veggies,carrot|dining table|fork,,,False
288862,000000288862.jpg,a skateboarder does a trick in an indoor arena,person|skateboard,person,,False
288882,000000288882.jpg,two giraffes in their pen outside of a building,giraffe,giraffe,,False
289059,000000289059.jpg,a tennis player is waiting for the serve,person|sports ball|tennis racket,person,,False
289222,000000289222.jpg,a traffic light that has a picture of a horse,bus|horse|person|traffic light,traffic light|horse,,False
289229,000000289229.jpg,a man in a lab coat holding a magnifying glass,person|tie,person,,False
289343,000000289343.jpg,a person on a bike near a building,bench|bicycle|dog|person,person|bicycle,,False
289393,000000289393.jpg,a couple of small plastic animals standing next to each other,bird|cow|giraffe|person|potted plant,,,False
289415,000000289415.jpg,a bunch of pizzas are being served on plates,person|pizza|spoon,pizza,,False
289417,000000289417.jpg,the boy is practicing his skiing skills in the snow,bench|person|skis,person,,False
289516,000000289516.jpg,the clock is located in a park,clock,clock,,False
289586,000000289586.jpg,a giraffe's neck showing it's head near some rocks,giraffe,giraffe,,False
289594,000000289594.jpg,old man standing on the side walk at an intersection,car|person,person,,False
289659,000000289659.jpg,a giraffe is in an enclosure by some dry grass,giraffe,giraffe,,False
289702,000000289702.jpg,a black dog sits next to an ornate mirror,dog,dog,,False
289741,000000289741.jpg,a cruise ship is docked by some pretty sandy beach,boat|chair|handbag|person|umbrella,boat,,False
289938,000000289938.jpg,a food cart is parked along a busy city street,bottle|car|handbag|hot dog|person|umbrella,,,False
289960,000000289960.jpg,a man flies a kite while walking on a beach,kite|person,person|kite,,False
289992,000000289992.jpg,a small bathroom has white tile and a tub,orange|sink,,,False
290081,000000290081.jpg,a bunch of oranges sitting in a glass bowl,bowl|dining table|orange,orange|bowl,,False
290163,000000290163.jpg,two children in chef hats and aprons eat food from a plate,bowl|chair|dining table|person|pizza,person|person,,False
290179,000000290179.jpg,a beautiful aerial view of london city and its surroundings,boat|bus|car|clock|person|truck,,,False
290248,000000290248.jpg,a crowd of people that are standing in the street,backpack|handbag|person|suitcase|truck,person,,False
290293,000000290293.jpg,a subway train coming into a train station,person|train,train|train,,False
290592,000000290592.jpg,a herd of animals standing on top of grass,sheep,,,False
290619,000000290619.jpg,a banana and blue container on the counter,banana|bowl|dining table|person,banana|bowl,,False
290768,000000290768.jpg,"the kitchen is full of appliances, including a coffee maker",bottle|cup|knife|oven|sink,,,False
290771,000000290771.jpg,a living room with large windows overlook a wooded forest,book|chair|couch|cup|dining table|tv,,,False
290833,000000290833.jpg,two zebras that are standing in the grass,giraffe|person|zebra,zebra,,False
290843,000000290843.jpg,a brown and white cat is staring at a laptop,bed|cat|laptop|person,cat|laptop,,False
291490,000000291490.jpg,a cat sitting on top of a blue blanket,bed|cat,cat,,False
291551,000000291551.jpg,a young man performing skateboarding tricks on a concrete ramp,bench|person|skateboard,person,,False
291619,000000291619.jpg,two men playing frisbee in a field at night,frisbee|person,person|frisbee,,False
291634,000000291634.jpg,several motorcycles are parked in front of shops,bicycle|motorcycle|person,motorcycle,,False
291664,000000291664.jpg,a dog sniffing a fire hydrant in a park,dog|fire hydrant,dog|fire hydrant,,False
291791,000000291791.jpg,a vintage army motorcycle parked in the grass,backpack|handbag|motorcycle|person,motorcycle,,False
291861,000000291861.jpg,a black and white photo of a zebra in the wild,zebra,zebra,,False
292005,000000292005.jpg,a bathtub is shown with a curtain on the side,bottle|orange|sink|toilet,,,False
292024,000000292024.jpg,the woman smiles as she looks at a giant pizza,cup|fork|person|pizza,person|pizza,,False
292060,000000292060.jpg,white appliances and cabinets in an empty kitchen,bottle|cup|knife|microwave|oven|refrigerator|sink,,,False
292082,000000292082.jpg,a man sitting next to a child holding him,chair|person|tie,person|person,,False
292155,000000292155.jpg,a multicolored umbrella is shown against a blue sky,person|umbrella,umbrella,,False
292225,000000292225.jpg,a man playing tennis in a fenced in area,person|tennis racket,person,,False
292236,000000292236.jpg,three young men are standing on a platform by a train,person|suitcase|train,person|train,,False
292330,000000292330.jpg,a dog playing baseball with a bat,baseball bat|dog|sports ball,dog,,False
292415,000000292415.jpg,skateboarder at the top of a half pipe during sunset,person|skateboard,person,,False
292446,000000292446.jpg,people in an office workroom with boxes and pizzas,dining table|laptop|person|pizza|tv,person|pizza,,False
292456,000000292456.jpg,the man is riding on a moped by a woman,handbag|motorcycle|person|potted plant|suitcase,person|motorcycle|person,,False
292488,000000292488.jpg,a woman in brown coat looking at her cell phone,cell phone|person,person|cell phone,,False
292908,000000292908.jpg,surfer catching a small wave at sunset on the beach,person|surfboard,,,False
292997,000000292997.jpg,two cars that are parked in the snow,car|person|traffic light|truck,car,,False
293044,000000293044.jpg,"an open lunch box containing bread, carrots and hummus",bowl|carrot|dining table|sandwich|spoon,carrot,,False
293071,000000293071.jpg,an american flag painted fire hydrant near a town street,car|fire hydrant,fire hydrant,,False
293200,000000293200.jpg,a young boy is flying his kite in a park,backpack|bottle|kite|person,person|kite,,False
293245,000000293245.jpg,a motorcycle sits parked outside of the 50th anniversary celebration,motorcycle|potted plant,motorcycle,,False
293300,000000293300.jpg,an elephant in a stone enclosure behind a metal fence,elephant|person,elephant,,False
293324,000000293324.jpg,three air planes are parked near a control tower,airplane|bus|person|truck,airplane,,False
293390,000000293390.jpg,the bathroom is decorated in rustic style with marble top,bottle|sink|toothbrush,,,False
293474,000000293474.jpg,a yellow and black fire hydrant in front of storefronts,book|fire hydrant|frisbee,fire hydrant,,False
293625,000000293625.jpg,a couple of women sitting down playing nintendo wii,bottle|couch|person|potted plant|remote|wine glass,person,,False
293794,000000293794.jpg,a number of bananas being displayed at a farmers market,banana|car|dining table|person|tie,banana,,False
293804,000000293804.jpg,the living room has leather furniture with a fireplace,chair|couch|potted plant|vase,,,False
293858,000000293858.jpg,a sandwich and salad sitting on a white plate,bottle|carrot|chair|cup|dining table|hot dog|sandwich,sandwich,,False
294162,000000294162.jpg,an open laptop with a mouse on the desk,laptop|mouse,laptop|mouse|dining table,dining table,True
294163,000000294163.jpg,a large clock tower under a blue sky,clock,clock,,False
294350,000000294350.jpg,several people in a kitchen prepare food for the customers,banana|bottle|bowl|oven|person,person,,False
294695,000000294695.jpg,two girls are flying flags on the beach,kite|person,person,,False
294783,000000294783.jpg,an unmade mattress in a large room,backpack|bed|book|clock|couch|suitcase,,,False
294831,000000294831.jpg,a piece of pizza is on a black plate,cup|dining table|laptop|person|pizza,pizza,,False
294855,000000294855.jpg,an old suitcase is seen with other pieces of luggage,bottle|bowl|suitcase,suitcase|suitcase,,False
295138,000000295138.jpg,the skateboarder balances himself on his board,bench|person|skateboard,person,,False
295231,000000295231.jpg,an image of a group of sheeps in the field,sheep,sheep,,False
295316,000000295316.jpg,some surfers are waiting for waves to crest,person|surfboard,,,False
295420,000000295420.jpg,a blue delivery truck moving along a residential road,car|person|truck,truck,,False
295478,000000295478.jpg,a woman is walking her small white dog,dog|handbag|person,person|dog,,False
295713,000000295713.jpg,woman sits on concrete bench next to statue of a person reading,bench|cell phone|handbag|person,person|bench|person,,False
295797,000000295797.jpg,a clock tower with a weather vane on top,clock,clock,,False
295809,000000295809.jpg,an empty bicycle lane with a bike crossing symbol,bicycle|car|fire hydrant|person|traffic light,bicycle|bicycle,,False
296222,000000296222.jpg,a person sitting down with a plate of food in front of him,chair|cup|fork|handbag|person|pizza,person,,False
296224,000000296224.jpg,a commuter bus parked on the side of a road,bus|car|person,,,False
296231,000000296231.jpg,the living room is very cluttered with some things,book|chair|clock|person|potted plant|tv|vase,,,False
296284,000000296284.jpg,a glass shelf holding baked goods in a bakery,donut,,,False
296317,000000296317.jpg,animals standing around an area with a dirt trail going up the hill,giraffe,,,False
296634,000000296634.jpg,four dishes with soup and a salad on the ground,bowl|broccoli|carrot,,,False
296649,000000296649.jpg,motorcyclists and pedestrians ride down the street in this busy city,bicycle|bird|car|motorcycle|person|truck,,,False
296657,000000296657.jpg,a group of young men jumping up into the air,cell phone|fire hydrant|person|tie,person,,False
296969,000000296969.jpg,a family of giraffes is walking by trees and grass,giraffe,giraffe,,False
297022,000000297022.jpg,an old black and white photo of a fire truck,bed|person|truck,truck,,False
297084,000000297084.jpg,woman in robe holding up a piece of food,bottle|bowl|chair|cup|dining table|person|spoon|wine glass,person,,False
297085,000000297085.jpg,a cat sits in front of the television set,cat|teddy bear|tv,cat|tv,,False
297147,000000297147.jpg,motorcycle is shown parked on the pavement near a building,motorcycle|person,motorcycle,,False
297343,000000297343.jpg,a stop sign is hanging on a door,stop sign,stop sign,,False
297353,000000297353.jpg,a man playing a guitar on top of a bed,bed|book|bottle|person,person|bed,,False
297396,000000297396.jpg,there is chocolate desert with white icing on it,cake|dining table|knife|train,,,False
297427,000000297427.jpg,a donut is on top of a burger,donut|person|sandwich,donut|sandwich,,False
297562,000000297562.jpg,a woman at a hair salon is holding a baby,car|chair|person|scissors,person|person,,False
297578,000000297578.jpg,a man in a suit smoking a cigarette,car|handbag|person|tie,person,,False
297595,000000297595.jpg,a man is surfing the waves in a ocean,person|surfboard,person,,False
297681,000000297681.jpg,several street signs in the flooded area of a city,car,,,False
297698,000000297698.jpg,skier in black and white jumping over buildings,person|skis,person,,False
297830,000000297830.jpg,an adorable dog is posing with his beer,bottle|dog,dog,,False
298251,000000298251.jpg,two zebras and several antelope are on a hill,zebra,zebra,,False
298396,000000298396.jpg,the kitchen is full of stainless steel appliances and counters,banana|bowl|chair|clock|dining table|knife|oven|person|scissors|sink,,,False
298697,000000298697.jpg,a field with cattle and buildings in the background,cow|horse,cow,,False
298738,000000298738.jpg,a panda bear eating some bamboo leaves in the sun,bear,bear|bear,,False
298904,000000298904.jpg,a fish tank filled with rocks and flowers,bowl|vase,,,False
298994,000000298994.jpg,a collection of fresh vegetables on top of a wooden pallet,broccoli|carrot|dining table,,,False
299355,000000299355.jpg,a plate of food with broccoli and mushrooms,broccoli|dining table,broccoli,,False
299553,000000299553.jpg,several kites are being flown over a crowd,kite|person,kite,,False
299609,000000299609.jpg,a horse grazing in an open pasture with mountains behind,horse,horse,,False
299720,000000299720.jpg,a giraffe looking out of its wooden enclosure,giraffe|person,giraffe,,False
299887,000000299887.jpg,a man and woman pose for a picture on a motorcycle,motorcycle|person|truck,person|person|motorcycle,,False
300039,000000300039.jpg,someone is taking a picture with their cellphone,bottle|cell phone|cup|dining table|person,cell phone,,False
300155,000000300155.jpg,a bird is perched on a branch next to leaves,bird,bird,,False
300233,000000300233.jpg,ingredients to make a pasta recipe including basil,bottle|bowl|dining table|spoon,,,False
300276,000000300276.jpg,three women wearing t - shirts and hats standing in front of some desserts,bench|bowl|cake|chair|cup|dining table|person,person,,False
300341,000000300341.jpg,two young men playing wii together while others watch,person|remote,person,,False
300659,000000300659.jpg,eight airplanes performing a formation in the sky,airplane,airplane,,False
300842,000000300842.jpg,the skateboard has blue wheels on the platform,person|skateboard,skateboard,,False
300913,000000300913.jpg,a white cat laying on a green pillow,cat|couch,cat,,False
301061,000000301061.jpg,the elephant is coming in to the truck door,elephant|person|truck,elephant|truck,,False
