image_id,fname,caption,gt,mentioned,wrong,is_hall
439773,000000439773.jpg,a toddler on the ground next to a remote,cell phone|person|teddy bear,remote,remote,True
439854,000000439854.jpg,skateboarders are in silhouette as the sun sets,backpack|bicycle|person|skateboard,person,,False
439994,000000439994.jpg,baseball players at home plate during a game,baseball glove|bench|chair|person|sports ball,person,,False
440171,000000440171.jpg,a man is riding on top of an elephant,elephant|person,person|elephant,,False
440184,000000440184.jpg,three people play tennis on an outdoor court,cup|person|sports ball|tennis racket,person,,False
440336,000000440336.jpg,a group of guys playing frisbee on a field,frisbee|person,person|frisbee,,False
440475,000000440475.jpg,a living room has several furniture and lamps in it,apple|book|bowl|chair|couch|dining table|person|potted plant|tv|vase,,,False
440507,000000440507.jpg,a blue suitcase sitting on top of a wooden floor,dining table|suitcase|umbrella,suitcase,,False
440508,000000440508.jpg,a train is riding on railroad tracks through the woods,car|orange|train,train,,False
440617,000000440617.jpg,train on tracks with overhead power lines behind it,person|traffic light|train,train,,False
441247,000000441247.jpg,a woman standing in a kitchen next to a living room,backpack|banana|bottle|chair|clock|couch|dining table|handbag|microwave|orange|oven|person|refrigerator|vase,person,,False
441286,000000441286.jpg,a surfer in a black wet suit rides a wave,person|surfboard,,,False
441442,000000441442.jpg,a horse running around a green field with trees,chair|horse|person,horse,,False
441468,000000441468.jpg,a red and gray fire hydrant on the street,car|fire hydrant|person,fire hydrant,,False
441491,000000441491.jpg,three beautiful young women sharing a bite of pizza,cup|person|pizza,person|pizza,,False
441543,000000441543.jpg,a crowd of people holding multi - colored umbrellas,backpack|cell phone|person|umbrella,person|umbrella,,False
441553,000000441553.jpg,a large group of people at a busy bus stop,bird|handbag|person|traffic light|train,person,,False
441586,000000441586.jpg,a man standing in the middle of a dirt field with wheels,bicycle|motorcycle|person|stop sign,person,,False
442009,000000442009.jpg,a bathroom with a large tub and a large window,bottle|sink|vase,,,False
442161,000000442161.jpg,a man and two women are holding up wine glasses,handbag|person|wine glass,person|person|wine glass,,False
442306,000000442306.jpg,a young girl standing in the woods with an umbrella,person|umbrella,person|umbrella,,False
442323,000000442323.jpg,a hotel room with the tv on on a dresser,bed|chair|dining table|remote|suitcase|tv,tv,,False
442456,000000442456.jpg,the front end of a white pickup truck,bed|car|cell phone|handbag|person|truck,truck|truck,,False
442463,000000442463.jpg,a skateboarder in safety gear on a paved area,person|skateboard,person,,False
442480,000000442480.jpg,large propeller airplane at night on the tarmac,airplane|person|truck,airplane,,False
442661,000000442661.jpg,a giraffe is standing inside a window in a building,giraffe,giraffe,,False
442746,000000442746.jpg,a woman standing in a park catching a frisbee,car|frisbee|person|traffic light,person|frisbee,,False
442822,000000442822.jpg,many boats are docked on the river bank,boat,boat,,False
442836,000000442836.jpg,three men are playing frisbee in a field,frisbee|person,person|frisbee,,False
442993,000000442993.jpg,a night time scene with an old building and tower,boat|clock|potted plant,,,False
443303,000000443303.jpg,a cat that is sitting on some kind of suit case,book|cat|orange|suitcase,cat|suitcase,,False
443426,000000443426.jpg,a man in glasses is sitting and talking,chair|person|tie,person,,False
443498,000000443498.jpg,the bus has stopped in a dark and empty garage,bus|person,,,False
443844,000000443844.jpg,a person skateboarding on a wooden bench,bench|person|skateboard,person|bench,,False
443969,000000443969.jpg,the little girl is sitting in the shopping cart,person|umbrella,person,,False
444142,000000444142.jpg,a man holding a tennis racquet on a tennis court,chair|person|sports ball|tennis racket,person,,False
444275,000000444275.jpg,microwave sitting in the middle of a road near a fence,microwave|oven,microwave,,False
444879,000000444879.jpg,a train riding by a train platform,train,train|train,,False
445248,000000445248.jpg,a group of elephants standing next to each other,elephant,elephant,,False
445365,000000445365.jpg,two giraffes standing in a grassy field,giraffe|person,giraffe,,False
445439,000000445439.jpg,a close up of a zebra eating hay,zebra,zebra,,False
445602,000000445602.jpg,a skier on a mountain slope skiing in the snow,person|skis,person,,False
445658,000000445658.jpg,a large kitchen with black and white appliances,bottle|bowl|microwave|oven|refrigerator|sink|teddy bear,,,False
445675,000000445675.jpg,a giraffe stands near a body of water,giraffe,giraffe,,False
445722,000000445722.jpg,a group of luggage that are in a trailer,backpack|boat|person|suitcase|train,suitcase,,False
445792,000000445792.jpg,a girl is sitting down holding an electronic device,cell phone|couch|person|potted plant|remote,person,,False
445834,000000445834.jpg,some people in blue uniforms getting off a bus,bus|person,person,,False
445846,000000445846.jpg,this is a very clean kitchen with windows,microwave|oven|refrigerator|sink,,,False
445999,000000445999.jpg,there is a young woman brushing her teeth,person|toothbrush,person,,False
446005,000000446005.jpg,a large kitchen with hardwood cabinetry and tile flooring,book|microwave|oven|sink,,,False
446117,000000446117.jpg,an orange sits on the side of a wooden bench,bench|dining table|orange,orange|bench,,False
446206,000000446206.jpg,an elevated bus that is traveling down the road,bus|person|train,,,False
446207,000000446207.jpg,the camera is next to a digital camera,cell phone|dining table,,,False
446522,000000446522.jpg,a dog sitting in a chair in a room,chair|dining table|dog|refrigerator,dog|chair,,False
446574,000000446574.jpg,a bathroom with a bathtub shower curtain and toilet,bottle|toilet,toilet,,False
446651,000000446651.jpg,a man and little girl on a motor cycle,car|motorcycle|person,person|person|motorcycle,,False
446703,000000446703.jpg,a stuffed animal that is laying down inside of a dresser,dining table|teddy bear,,,False
447088,000000447088.jpg,three baseball players walking on a field with a bat,baseball bat|person,person,,False
447169,000000447169.jpg,a kitchen with white cabinets and appliances,bottle|chair|clock|oven|refrigerator,,,False
447187,000000447187.jpg,a player is swinging at a baseball that was pitched,baseball bat|baseball glove|person|sports ball,person,,False
447200,000000447200.jpg,two dogs on leashes standing on a brick path,dog,dog,,False
447313,000000447313.jpg,a group of zebras grazing on grass in a forest,zebra,zebra,,False
447314,000000447314.jpg,a group of people flying kites in a park,kite|person,person|kite,,False
447342,000000447342.jpg,a bus and a trolley on a city street,bus|car|truck,bus,,False
447465,000000447465.jpg,skiiers are taking part in the competition of the event,person|skis|snowboard,,,False
447522,000000447522.jpg,a plate with rice and vegetables on it,broccoli|carrot|dining table|spoon,,,False
447611,000000447611.jpg,someone cutting through a laptop with a knife,knife|laptop|person,laptop|knife,,False
447789,000000447789.jpg,two street signs with one pointing to the right,,,,False
447917,000000447917.jpg,four young boys playing soccer in a green field,bicycle|person|sports ball,person,,False
448076,000000448076.jpg,people standing in a room with big bags and pillows,chair|handbag|person|potted plant|remote|tv,person,,False
448256,000000448256.jpg,three men looking at a small boat on the road,boat|bottle|car|person|truck,person|boat,,False
448263,000000448263.jpg,a baseball player kneels while talking to another player,baseball glove|person|sports ball,person|person,,False
448365,000000448365.jpg,a young boy is doing a trick on a skateboard,bicycle|person|skateboard,person|skateboard,,False
448410,000000448410.jpg,a train engine pulling many carts through a station,bench|car|handbag|person|train,train,,False
448448,000000448448.jpg,two giraffes eat leaves from some very small branches,giraffe,giraffe,,False
448810,000000448810.jpg,street signs in foreign countries on the corner of a street,person,,,False
449190,000000449190.jpg,a burrito wrapped in paper with a drink and salad,bowl|carrot|cup|dining table|sandwich,,,False
449198,000000449198.jpg,a freeway passes under a pedestrian bridge in the night,car|stop sign|traffic light|train,,,False
449312,000000449312.jpg,a woman looks at the dishes on the table,bowl|cake|car|donut|person,person|dining table,dining table,True
449406,000000449406.jpg,a lone zebra standing among a rocky area,zebra,zebra,,False
449432,000000449432.jpg,a group of people standing in front of a bus,backpack|boat|bus|handbag|person|suitcase|train,person,,False
449579,000000449579.jpg,a tennis player is playing on the court,person|sports ball|tennis racket,person,,False
449603,000000449603.jpg,a person in black wetsuit surfing on waves with parachute,kite|person|surfboard,person,,False
449661,000000449661.jpg,a hospital room with many medical equipment in it,bed|chair|person|sink|tv,,,False
449909,000000449909.jpg,a man in a denim jacket looking at a giraffe,giraffe|person,person|giraffe,,False
449996,000000449996.jpg,an airport runway with several airplanes parked at it,airplane|truck,airplane,,False
450075,000000450075.jpg,two women wearing white are having their hair styled,person|tie,person,,False
450100,000000450100.jpg,a cupcake with pink icing and yellow star on it,boat|cake|cup|dining table|spoon,cake,,False
450202,000000450202.jpg,"a plate with ham, cheese and other meats",dining table|fork|person|wine glass,,,False
450303,000000450303.jpg,people are working in an open classroom with laptops,bottle|cell phone|chair|clock|dining table|laptop|person,person|laptop,,False
450399,000000450399.jpg,several people prepare food inside of a kitchen,bowl|cell phone|donut|person|spoon,person,,False
450439,000000450439.jpg,two large kites flying in the blue sky,kite,kite,,False
450488,000000450488.jpg,there is a small television in a bedroom,bed|sink|tv,tv,,False
450559,000000450559.jpg,a person on a skate board in the air,person|skateboard,person,,False
450686,000000450686.jpg,someone holding a small smart phone with various app icons on it,cell phone|person,cell phone,,False
450758,000000450758.jpg,a group of giraffes run across a large field,giraffe,giraffe,,False
451043,000000451043.jpg,a woman is skiing on a snowy slope,person|skis|snowboard,person,,False
451084,000000451084.jpg,a person jumping a skate board in the air,person|skateboard,person,,False
451090,000000451090.jpg,boat on the water with mountain background in the background,boat,boat,,False
451144,000000451144.jpg,two skiers standing at the top of a mountain slope,backpack|person|skis,person,,False
451150,000000451150.jpg,several assorted doughnuts in an open box,donut,donut,,False
451155,000000451155.jpg,a person on their computer in the dark,bed|laptop|person,person|laptop,,False
451308,000000451308.jpg,stacking suitcases stacked high up in a room,book|suitcase,suitcase,,False
451435,000000451435.jpg,an aerial view of tennis players on the court,person|sports ball|tennis racket,person,,False
451571,000000451571.jpg,"a plate of food, including an open ear of corn",chair|pizza|sandwich,,,False
451693,000000451693.jpg,a pizza sitting on top of a white plate,dining table|pizza,pizza,,False
451714,000000451714.jpg,a person with ski gear standing on a snowy slope,person|skis,person|skis,,False
451879,000000451879.jpg,a group of young men playing a game of baseball,baseball glove|person|sports ball,person,,False
452084,000000452084.jpg,there is a small fork in the dish,bowl|dining table|fork|hot dog,fork,,False
452122,000000452122.jpg,a large jetliner flying through a gray sky,airplane,airplane,,False
452321,000000452321.jpg,a red bus is parked at a bus stop,bus,,,False
452515,000000452515.jpg,a woman holding a tennis racquet on a tennis court,person|sports ball|tennis racket|tv,person,,False
452784,000000452784.jpg,a person is washing a bowl of greens,bowl|broccoli|orange|person|sink,person|bowl,,False
452793,000000452793.jpg,this kitchen has a large refrigerator with two doors open,refrigerator|sink,refrigerator,,False
452891,000000452891.jpg,a little dog on a chain around his harness,bench|dog,dog,,False
453001,000000453001.jpg,two women with a suitcase and a mop,bench|person|potted plant|suitcase,person|suitcase,,False
453040,000000453040.jpg,the wedding cake is adorned with flowers and vines,cake|dining table,cake,,False
453166,000000453166.jpg,three military men are standing together holding awards,person|tie,person,,False
453302,000000453302.jpg,a small kitchen with wooden floors and tiled floor,bottle|chair|microwave|oven|refrigerator|sink|toaster,,,False
453341,000000453341.jpg,an assortment of figurines is displayed on a shelf,bench|cell phone|couch|keyboard|mouse|teddy bear|tv,,,False
453584,000000453584.jpg,a red bench is outside a bar,bench|chair,bench,,False
453634,000000453634.jpg,a small bathroom features an enclosed shower,chair|sink|toilet,,,False
453708,000000453708.jpg,a young woman carrying a huge bundle of bananas,banana|person,person|banana,,False
453722,000000453722.jpg,a big room with wood flooring and a fireplace,chair|couch|tv,,,False
453841,000000453841.jpg,traffic at sunset near an intersection with cars waiting to cross,car|fire hydrant|person|traffic light|truck,car,,False
453860,000000453860.jpg,the back and front views of an air portable device,suitcase,,,False
453981,000000453981.jpg,two black bears playing together on the grass,bear|person,bear,,False
454067,000000454067.jpg,a woman in green shirt playing a game on the nintendo wii,book|person|remote|tv,person,,False
454404,000000454404.jpg,a woman with her feet on a wooden bench,bench|cell phone|chair|person|potted plant,person|bench,,False
454661,000000454661.jpg,an auto traffic jam on a city street at night,bus|car|traffic light,,,False
454750,000000454750.jpg,a couple of zebra standing next to each other,zebra,zebra,,False
454798,000000454798.jpg,a horse that is standing up in the dirt,bus|horse|person|truck,horse,,False
454978,000000454978.jpg,a motorcycle parked at a turn on a rural road,motorcycle|person,motorcycle,,False
455085,000000455085.jpg,a bus is at a bus stop at dusk,bus|person,,,False
455157,000000455157.jpg,an older man sits under a blue umbrella,bench|dining table|laptop|person|umbrella,person|umbrella,,False
455219,000000455219.jpg,two brown cows walking along a dirt path,cow|person,cow,,False
455267,000000455267.jpg,a wok with some food being stirred with oil,broccoli|carrot|oven,,,False
455301,000000455301.jpg,a woman and a baby are laying in bed,bed|book|person,person|person|bed,,False
455352,000000455352.jpg,an ornately designed clock tower with a cross on top,clock,clock,,False
455448,000000455448.jpg,a hand holding a chocolate cupcake with sprinkles,cake|cup|person|sports ball,cake,,False
455555,000000455555.jpg,a young boy sitting on a skateboard on a sidewalk,motorcycle|person|skateboard,person|skateboard,,False
455597,000000455597.jpg,a black and white photo of a woman in a kitchen,bottle|bowl|cup|oven|person|spoon,person,,False
455624,000000455624.jpg,"a motorcyclist with helmets on, riding by hay bales at an",motorcycle|person,,,False
455716,000000455716.jpg,a row of motorcycles parked on the grass,backpack|handbag|motorcycle,motorcycle,,False
455872,000000455872.jpg,black and white photograph of a fishing village,boat,,,False
455937,000000455937.jpg,a man sits in front of the television playing games,book|chair|clock|couch|cup|handbag|laptop|person|remote|suitcase|tv,person|tv,,False
455981,000000455981.jpg,an image of toilet with the lid up,bowl|chair|toilet,toilet,,False
456015,000000456015.jpg,four people on horses are galloping along a beach,horse|person,person|horse,,False
456143,000000456143.jpg,"two baskets that have pizza, salad and french fries",bowl|carrot|dining table|pizza|sandwich,pizza,,False
456292,000000456292.jpg,a graffiti drawing on the wall of a restroom,bottle|cat,,,False
456303,000000456303.jpg,a snowboarder performing a jump off a jump,handbag|person|snowboard,person,,False
456394,000000456394.jpg,a blue motorcycle on display in a showroom,car|motorcycle,motorcycle,,False
456496,000000456496.jpg,a woman is sitting by the eiffel tower,bird|handbag|person,person,,False
456559,000000456559.jpg,"a man in a brown jacket, striped shirt and black hat",person|tie,person,,False
456662,000000456662.jpg,a little girl standing next to the refrigerator,person|refrigerator,person|refrigerator,,False
456865,000000456865.jpg,a large jetliner sitting on top of an airport runway,airplane,airplane,,False
457078,000000457078.jpg,a large fake skeleton in a living room,book|chair|cup|dining table|laptop|person|remote|tv,,,False
457262,000000457262.jpg,an image of a one cent coin and a fruit,banana|dining table,,,False
457559,000000457559.jpg,three men are playing soccer against each other,person|sports ball,person,,False
457848,000000457848.jpg,a row of motorcycles are lined up in a row,motorcycle|person,motorcycle,,False
457884,000000457884.jpg,a young boy wearing a glove catches the baseball,baseball glove|car|motorcycle|person|sports ball|truck,person,,False
458045,000000458045.jpg,a little leaguer at home plate waiting for the pitch,baseball bat|baseball glove|person|sports ball,,,False
458054,000000458054.jpg,a bunch of toilets that are sitting outside,chair|toilet,toilet,,False
458109,000000458109.jpg,a close up shot of a railroad track,person|train,,,False
458223,000000458223.jpg,two people walking and pushing bikes past the ocean,backpack|bicycle|boat|person,person|bicycle,,False
458255,000000458255.jpg,a woman lies in bed while holding a cat,bed|book|cat|person,person|bed|cat,,False
458325,000000458325.jpg,a skateboarder is riding down the street in traffic,car|person|skateboard|traffic light,person,,False
458410,000000458410.jpg,a small room with wood paneling and a checkered rug,book|couch|dining table|tv|wine glass,,,False
458663,000000458663.jpg,an empty kitchen and dining room with wooden floors,chair|couch|cup|dining table|knife|oven|scissors|sink|umbrella,,,False
458702,000000458702.jpg,a parking meter sitting on the side of a road,car|parking meter,parking meter,,False
458755,000000458755.jpg,a woman is petting a sheep with her hands,person|sheep,person|sheep,,False
458768,000000458768.jpg,modern kitchen and living room are decorated in white,bench|couch|oven|sink,,,False
458790,000000458790.jpg,view out the windows of a train in the winter,train,train,,False
458992,000000458992.jpg,a woman sitting at a table with a large pizza,fork|knife|person|pizza,person|dining table|pizza,dining table,True
459153,000000459153.jpg,man sitting on park bench using a laptop computer,backpack|bench|laptop|person,person|bench|laptop,,False
459195,000000459195.jpg,three people sitting on a log in the woods,bench|frisbee|person,person,,False
459272,000000459272.jpg,a woman looking at a phone in a crowd,cell phone|person,person|cell phone,,False
459396,000000459396.jpg,cows grazing on tall grass in fenced area,cow,cow,,False
459437,000000459437.jpg,a number of animals in a pen near one another,bowl|cup|person|sheep,,,False
459467,000000459467.jpg,a small plane sitting on the runway near grass,airplane|person,airplane,,False
459500,000000459500.jpg,a tall metal clock sitting on top of a post,bird|car|clock,clock,,False
459634,000000459634.jpg,a motorcyclist's view looking down an empty street,motorcycle|person,,,False
459662,000000459662.jpg,two children looking through glazed donuts with icing,chair|donut|person,person|donut,,False
459757,000000459757.jpg,a small giraffe in some green grass near palm trees,giraffe,giraffe,,False
459809,000000459809.jpg,kites are flying low to the ground above water,boat|kite|person,kite,,False
459887,000000459887.jpg,the bananas are sitting in a colander with dark spots,banana|bowl|dining table,banana,,False
459954,000000459954.jpg,some very old appliances in the building,person|refrigerator,,,False
460147,000000460147.jpg,vehicles travel along a busy street in an asian city,bus|car|motorcycle|person|traffic light|truck,,,False
460160,000000460160.jpg,a swan sitting on the sand by a river,bird,bird,,False
460229,000000460229.jpg,a stop sign is at an intersection by some tracks,car|stop sign|traffic light|truck,stop sign,,False
460333,000000460333.jpg,a child sitting on his bed in a bedroom,bed|chair|person,person|bed,,False
460347,000000460347.jpg,a white bus traveling down a road surrounded by traffic,bus|car|person,,,False
460379,000000460379.jpg,three giraffes standing in an enclosure with trees,giraffe|person,giraffe,,False
460494,000000460494.jpg,a red plate with various foods sits on a table,bowl|broccoli|carrot|cup|dining table|fork|knife,dining table,,False
460682,000000460682.jpg,a dog on a leash in a grassy field,horse,dog,dog,True
460683,000000460683.jpg,an old man is holding a neck tie,chair|dining table|person|tie,person|tie,,False
460841,000000460841.jpg,a bottle of water is being held open,bottle|cat|person|toilet,bottle,,False
460927,000000460927.jpg,black and white photograph of a bear in the mountains,bear|person,bear,,False
460929,000000460929.jpg,a hot dog and a bottle of bubble up soda,bottle|dining table|hot dog,hot dog|bottle,,False
460967,000000460967.jpg,a transit bus is parked in front of a building,bus|person,,,False
461009,000000461009.jpg,a man holding up an apple with the words think different,apple|chair|person|sports ball,person|apple,,False
461036,000000461036.jpg,a black bear walking through a forest filled with trees,bear,bear,,False
461275,000000461275.jpg,a street sign giving directions on a road corner,,,,False
461405,000000461405.jpg,a flock of sheep graze in an open area,sheep,sheep,,False
461573,000000461573.jpg,a bench sitting in the middle of a park,bench,bench,,False
461751,000000461751.jpg,the man with glasses is riding his motorcycle through traffic,backpack|car|motorcycle|person,person|motorcycle,,False
462031,000000462031.jpg,a baseball player preparing to swing at a pitch,baseball bat|person|sports ball,person,,False
462371,000000462371.jpg,a black and white photograph shows several people getting ready to serve food,cake|cup|knife|person|tie,person,,False
462576,000000462576.jpg,"breakfast dishes including eggs, ham and orange slices",bowl|cup|dining table|orange,orange,,False
462614,000000462614.jpg,the painting depicts a yellow bathroom,chair|potted plant|sink|toilet,,,False
462629,000000462629.jpg,refrigerators and crates stacked up outside a building,refrigerator,refrigerator,,False
462643,000000462643.jpg,someone holding a broken device in their left hand,cell phone|person,,,False
462728,000000462728.jpg,a dog surfing on a small wave with its owner,dog|person|surfboard,dog,,False
462756,000000462756.jpg,a motorcycle parked on a dirt road next to a barn,bicycle|car|motorcycle|truck,motorcycle,,False
462904,000000462904.jpg,a black horse grazing outside in a wooden enclosure,chair|dining table|horse|person|potted plant|umbrella,horse,,False
463037,000000463037.jpg,a white plane with propeller sitting on a grass field,airplane|car|person,airplane,,False
463174,000000463174.jpg,a young woman playing tennis in pink and white clothes,person|sports ball|tennis racket,person,,False
463199,000000463199.jpg,three men smiling while standing inside a bus,backpack|bus|car|cell phone|handbag|person,person,,False
463283,000000463283.jpg,a drink with a slice of orange on the rim,cup|dining table|orange|spoon,orange,,False
463522,000000463522.jpg,two brown horses pulling two black carriages down a street,backpack|bicycle|dog|horse|person,horse,,False
463527,000000463527.jpg,a plate with two loaves and a beverage,airplane|bottle|bowl|carrot|cup|fork|sandwich,,,False
463542,000000463542.jpg,a group of people skiing down a snow covered slope,person|skis|snowboard,person,,False
463618,000000463618.jpg,a woman holding a baby next to a cage,bird|couch|person|tv,person|person,,False
463647,000000463647.jpg,construction signs with directions to detour and detour street,orange|truck,,,False
463690,000000463690.jpg,a man laying on the ground outside of a store,person|sports ball|tie,person,,False
463730,000000463730.jpg,bus on city street with people near building,backpack|bus|car|motorcycle|person,person,,False
463802,000000463802.jpg,a stuffed animal with an ad on it that is holding a tennis racquet,bear|person|teddy bear|tennis racket|tv,,,False
463842,000000463842.jpg,a bed with a lot of bottles on it,bed|bottle,bed|bottle,,False
463849,000000463849.jpg,a canal with boats parked on both sides of it,boat|car|motorcycle|person,boat,,False
463918,000000463918.jpg,two men playing wii with one holding a controller,couch|person|potted plant|remote,person,,False
464089,000000464089.jpg,a baseball player holding a bat next to home plate,baseball bat|baseball glove|person|sports ball,person,,False
464144,000000464144.jpg,a man is skiing down the hill on the snow,person|skis,person,,False
464251,000000464251.jpg,a cardinal sits on a railing near some trees,bench|bird|chair|potted plant,,,False
464358,000000464358.jpg,a bedroom with two windows and an unmade bed,bed|chair|tv,bed,,False
464476,000000464476.jpg,a laptop that is on sitting on a wooden floor,dining table|laptop|person|train|tv,laptop,,False
464522,000000464522.jpg,a dog on a leash is standing in the grass,dog,dog,,False
464689,000000464689.jpg,a home entrance with stairs leading to the front door,bottle,,,False
464786,000000464786.jpg,a hotdog with some sort of condiment on it,hot dog|person,,,False
